id	parent	val_bpb	pre_quant_bpb	quant_tax	artifact_mb	step_avg_ms	crashed	size_violation	status	description
0118_spike_rank_v1_n5_ternary	0107_bigger_ternary_ssm_prod	1.88485280	1.8535	0.031353	9.078	1341.53	false	false	keep	Spike-rank embedding v1 (sparse-only, brief option c): replace nn.Embedding + tied lm_head with K=8 sparse rows via top-K STE on V x d weight. Math + 5 progressive toys verified pre-build (synthetic next-token converges to 0.0 loss). Post-quant 1.8849 / 9.08 MB (NO cap savings vs 0107 — sparse weight stored densely at int8) / step 1342ms / quant_tax 0.031 (high — sparse-weight value dynamic range hurts int8). Δ +0.359 vs 0107 — most-regressed of session. Likely K=8 too restrictive for 1024-vocab embeddings (loses per-token expressiveness); v1.5 with K=32 or sparse storage format (indices + values) would test cap savings claim. Both novel mechanisms (0117 + 0118) materially worse at 1k smoke — consistent with brief's note that single-seed at 200 MPS / 1k CUDA is too short for learnable structures. Real test = H100 5k+ steps with v2 designs (DFSM ordering for 0117, K=32 + sparse storage for 0118). [transfer:medium - infrastructure verified; v1 mechanism not competitive at 1k smoke]
0119_ema_n5_ternary_beta99	0116_ema_n5_ternary	1.54697933	1.5465	0.000479	8.986	1198.87	false	false	keep	EMA-of-weights at beta=0.99 (window=100; replaces 0116's beta=0.999 which lagged to near-init weights). Post-quant 1.5470 / 8.93 MB / step 1209ms. Δ +0.021 vs 0107. EMA INFRASTRUCTURE FULLY VERIFIED CORRECT — confirms 0116's val 2.20 was math-predicted hyperparameter mismatch (β=0.999 + 1k = full-window lag), not a bug. At 1k smoke, β=0.99 captures last 10% which is noisier than final weights, hence slight regression; at H100 5k+ steps with β=0.999 (window=1000=last 20%), expected to net positive. Implementation correct, ready for H100 deploy at β=0.999. [transfer:high - infrastructure verified for H100]
0120_dendrocentric_v2	0117_dendrocentric_v1_n5_ternary	null	null	null	null	null	true	false	TODO	TODO
0120_dendrocentric_v2	0117_dendrocentric_v1_n5_ternary	null	null	null	null	null	true	false	TODO	TODO
0120_dendrocentric_v2	0117_dendrocentric_v1_n5_ternary	1.89784572	1.8921	0.005746	6.179	1549.37	false	false	keep	Dendrocentric v2 (DFSM stored ordering per dendrite, soft-rank Pearson correlation, sigmoid NMDA). Math: scratch/2026-04-30_dendrocentric_v2_derivation.md; 4 toys pass. 5090 smoke at TRAIN_BATCH_TOKENS=32768 (4x reduced from v1's 131072 for K^2 buffer fit), 1000 steps. Post-quant 1.8978 / 6.18 MB / step 1549ms (47% slower than v1's 1052ms). Trains stably (no NaN, monotonic descent 13.91→3.02). NOT directly comparable to v1's 1.6812 due to 4x token deficit. CODE-VERIFY ONLY per feedback_5090_explore_h100_writeup; real test = H100 600s (exp 0122). [transfer:medium - infrastructure verified at fewer tokens]
0121_path_a_h100_5k	0119_ema_n5_ternary_beta99	2.36339062	2.3634	-0.000084	9.304	819.43	false	false	keep	Round 1 4×H200 de-risk: kill-Mamba-2 triple-parallel n=5 + ternary + EMA β=0.999 at 600s wallclock. Post-quant 2.36 = math-predicted EMA-short-train mismatch (window=1000 ≈ entire 733 steps, shadow ≈ near-init; same pattern as 0116). Infrastructure verified clean: no NaN, monotonic descent (6.25→2.39), eval ran. 4×H200 step time anchor: ~830ms/step at production batch 524288. Cost ~$3.72. [transfer:high — infrastructure anchor for H200 deploys]
0124_path_a_h200_1hr	0121_path_a_h100_5k	1.30040229	1.2983	0.002102	12.074	821.94	false	false	keep	**BEST PROJECT RESULT** Round 2 4×H200 long-train: kill-Mamba-2 triple-parallel + n=7 (BUMPED from 5; depth ceiling reverses at long-train) + ternary + EMA β=0.999 + brotli. 4380 steps × 524288 = 2.30B tokens in 3600s. Post-quant 1.3004 / 12.07 MB / quant_tax 0.002 / step 822ms. Δ vs prior best (0107/0108 mean 1.5232 at 5090 1k): **-0.22 BPB**. Compare records 1.1063 (8×H100, 600s, transformer + parallel-resid + GPTQ + sliding-window): gap 0.194 BPB. Compare non-records peer 1.1239 (1-bit, 2hr): gap 0.176. Cost ~$17. [transfer:high — non-records-track headline submission candidate]
