id	parent	val_bpb	pre_quant_bpb	quant_tax	artifact_mb	step_avg_ms	crashed	size_violation	status	description
0078_ema_on_gated_blend	0076_confidence_gated_blend	5.87242846	1.9979	3.874528	11.781	8837.05	false	false	discard	EMA at β=0.999 with only 200 training steps: shadow weights are 80% initial random + 20% trained (effective window 1/(1-β)=1000 >> 200 steps). val 5.87 (catastrophic). β=0.999 is wrong for short training; rerun with β=0.9 or 0.95 (window 10-20 steps). Re-launching as 0079.
0079_ema_beta_short	0078_ema_on_gated_blend	1.95326803	2.0020	-0.048732	15.834	8973.09	false	false	discard	EMA β=0.95 (window ~20 steps) on top of 0076: val 1.9533. vs 0076 single 1.9483 = +0.005. vs 0076 2-seed mean 1.9514 = +0.002 (neutral). EMA does not stack with the side-memory blend at this regime — likely because the static side memory already absorbs the smoothing benefit (rote N-gram lookup is a kind of high-coverage prior). Single-seed sufficient for this thread-1 port (per session-feedback discipline). [transfer:low — neutral here, may transfer to longer training]
0080_dense_attn_hsm	0076_confidence_gated_blend	1.95042284	2.0020	-0.051577	15.972	8876.17	false	false	discard	Dense-attention HSM (16 learnable keys × d_model with softmax attention readout, init values=0): val 1.9504. vs 0076 single 1.9483 = +0.002 (NEUTRAL within MPS noise). vs 0076 2-seed mean 1.9514 = -0.001 (neutral). UU#4-motivated bold-axis pivot from outside-eyes critique. Same conclusion as 0073 hash-HSM: 200-step training is insufficient for the value vectors to learn meaningfully on top of an already-strong static side memory. Cleaner gradient flow than 0073 (every key gets gradient via softmax mixing), but the bottleneck is training duration not gradient sparsity. Single-seed sufficient (per seed-discipline feedback). Future: revisit at H100 20k-step. [transfer:low]
0081_ar_gptq_int6	0076_confidence_gated_blend	1.94709857	1.9986	-0.051501	21.331	8732.41	false	true	discard	First run hid the AR self-gen bug behind a try/except fallback to train-stream cal — result is a TRAIN-STREAM-cal GPTQ int6, not AR self-gen. Artifact 21.33 MB cap-busts: int6-packed bytes (4 vals/3 bytes) are near-incompressible by brotli (saves 5% vs int8's 30%) so swap LOSES ~5.3 MB despite the 25% raw saving. AR self-gen path itself broken for Mamba2 (chunked scan needs seq_len%64==0). Fixed both (front-pad ctx, removed fallback). Relaunching as 0081b. [transfer:n/a]
0082_ar_gptq_int6_b	0081_ar_gptq_int6	1.94545509	1.9978	-0.052345	21.324	8512.23	false	true	discard	Rerun of 0081 with AR self-gen path FIXED (front-pad ctx to multiple of CHUNK_ALIGN=64) and silent fallback REMOVED. AR self-gen ran cleanly: 512 tokens generated in 31.3s. val_bpb 1.9455 (Δ -0.002 vs 0081 train-stream cal 1.9471 — within noise σ_pair=0.006). Artifact 21.32 MB — same cap-bust as 0081, confirming the int6+brotli incompressibility (~5% brotli savings on int6-packed vs ~30% on int8) is independent of calibration source. AR int6 closed: cap-busts in our family regardless of how cal data is sourced. [transfer:n/a]
0084_longkernel_conv1d	0076_confidence_gated_blend	null	null	null	null	8906.82	true	false	TODO	TODO
0083_ternary_body	0076_confidence_gated_blend	2.03033558	2.0998	-0.069464	16.812	8967.03	false	true	keep	BitNet b1.58 ternary body (BitLinear absmean STE in MLP/Mamba2/Attn): val 2.0303 + cap-bust 16.81 MB. Pre-quant 2.10 (model alone, +0.10 vs 0064=2.003 baseline) → ternary trains but adds penalty. Cap-bust because brotli inefficient on ternary int8 weights (ratio 0.89 vs 0076's 0.85). v2 packed-ternary serialization is mandatory to fit cap. [transfer:medium-low — informative null at v1, v2 cap-saving needed]
0086_v2_packed_ternary	0083_ternary_body	2.01279414	2.0933	-0.080506	7.956	8621.73	false	false	keep	v2 packed-ternary serialization: 2 bits/param for BitLinear weights (bypasses int8). artifact 7.96 MB vs 0083's 16.81 MB — FREED 8.86 MB cap. post-quant 2.0128 BETTER than 0083's 2.0303 (-0.018 BPB) because lossless packed beats int8-of-fp32 round-trip. Pre-quant 2.0933 matches 0083 (forward identical). v2 unlocks scale-up axis. [transfer:high — cap-saving + cleaner quant path]
0088_ternary_packed_dim640	0086_v2_packed_ternary	2.00797594	2.0881	-0.080124	10.769	11618.54	false	false	keep	d_model 512→640 + packed ternary body. val 2.008 vs 0086 (dim=512) 2.013 = -0.005 (NEUTRAL within MPS noise). artifact 10.77 MB vs 0086 7.96 MB = +2.81 MB for marginal gain. step time 11.6s vs 0086 8.6s = 35% slower. Scale-up alone at 200 steps below promote threshold. [transfer:medium — confirms scale alone insufficient at 200 MPS steps]
0089_fuzzy_kgram_softdp	0076_confidence_gated_blend	1.94893718	1.9986	-0.049663	15.87	8139.14	false	false	keep	Soft-DP fuzzy K-gram fallback (1-edit substitution at p1/p2/p3, FUZZY_DOWNWEIGHT=0.5): val 1.9489 vs 0076 single-seed 1.9483 = +0.0006 (NEUTRAL within MPS noise). Coverage probe predicted +40pp coverage gain but BPB didn't follow — fuzzy neighbor predictions downweighted by 0.5 collapse to bigram quality. Try DOWNWEIGHT=0.8/1.0 sweep next. [transfer:medium-low — coverage-vs-BPB disconnect is itself informative]
0091_fuzzy_kgram_softdp_dw_high	0089_fuzzy_kgram_softdp	1.95020253	2.0008	-0.050597	15.885	8147.92	false	false	discard	Fuzzy K-gram with DOWNWEIGHT=0.8 (vs 0089's 0.5): val 1.9502 (vs 0089 1.9489 = +0.0013, vs 0076 1.9483 = +0.002). Higher fuzzy confidence is mildly WORSE. Confirms 0089's diagnostic: fuzzy neighbors give noisier predictions than bigram fallback; raising trust amplifies noise. Soft-DP axis dead at this regime. [transfer:n/a — axis closed]
0087_ternary_lr_rescue	0083_ternary_body	1.98781416	2.0476	-0.059786	19.832	8353.39	false	true	keep	BitNet recipe rescue: MATRIX_LR=0.135 (×3 boost). Pre-quant 2.048 vs 0083's 2.10 = -0.052 BPB recovered (HALF the +0.10 ternary penalty). Post-quant 1.988 with cap-bust 19.83 MB (forked 0083, no v2 packing). Confirms LR axis is real for ternary; combined with 0086 v2 packed could land val ~1.99 at ~10 MB. [transfer:medium — recipe + cap path are the two ternary levers]
0092_dendritic_memory_v1_crash1	0086_v2_packed_ternary	null	null	null	null	null	true	false	crash	First launch crashed: dtype mismatch in dendritic_memory.forward (out fp32, projected bf16). Fixed in modules/dendritic_memory.py:239 with .to(out.dtype). Re-launching as 0092.
0092_dendritic_memory_v1	0086_v2_packed_ternary	2.01996199	2.1014	-0.081438	8.044	8401.06	false	false	discard	Dendritic memory v1 (warm-start K=4 patterns from 50M tokens, M=32K dendrites, learnable d_content=32 + zero-init proj→d_model). val 2.020 vs 0086 2.013 = +0.007 (slight regression). Smoke showed 20% fire rate per token (dense gradient flow), but content vectors didn't converge in 200 steps. Same failure mode as 0073/0080 — warm-start solved sparse-gradient issue but training-duration bottleneck remains. Brief option (d-warm) tested. [transfer:low — needs longer training; H100 20k might unlock]
0093_ternary_lr_rescue_packed	0086_v2_packed_ternary	1.99285864	2.0563	-0.063441	8.211	8347.30	false	false	keep	Combined: BitLinear ternary body + MATRIX_LR=0.135 (×3) + v2 packed-ternary serialization. val 1.993 at 8.21 MB. vs 0086 (no LR rescue) 2.013 = -0.020 BPB. vs 0087 (LR rescue, no v2) 1.988 cap-bust 19.83 MB → CLEAN COMPOSITION at half the cap. vs 0076 1.948 still +0.045. Confirms LR rescue and v2 packing are independent levers that stack. [transfer:high — best ternary result at full cap]
0094_dendritic_lr_rescue	0092_dendritic_memory_v1	1.99957411	2.0622	-0.062626	8.304	8424.19	false	false	discard	Dendritic v1 + LR×3 to test outside-eyes unified hypothesis. val 2.000 vs 0093 (LR×3 + v2 packed, no dendritic) 1.993 = +0.007 NEUTRAL. Dendritic content vectors did NOT unlock at LR×3. SPLIT FINDING: LR×3 helps BitLinear body (recovers half ternary penalty per 0087) but does NOT help dendritic content vectors — those are training-duration-bound, not LR-bound. Disambiguates 0073/0080/0092 failure mode partially. [transfer:medium — informative null]
0095_rank_coded_blend	0076_confidence_gated_blend	1.96733490	1.9997	-0.032365	15.892	8142.27	false	false	discard	Rank-coded blend (Option 3): replace per-(ctx, rank) log2p with global rank template at K=4 lookup. val 1.9673 vs 0076 single 1.9483 = +0.019 REGRESSION. Per-context log2p calibration IS load-bearing — global rank template loses 0.019 BPB. Brief's strong-form rank-info-suffices claim FALSIFIED at our regime. The per-context information that current top-2 storage carries is irreducible to global rank statistics. [transfer:high — empirical answer to brief central density question, NEGATIVE]
0085_hsm_no_static_disambig	0080_dense_attn_hsm	2.00833883	2.0068	0.001539	13.532	8147.94	false	false	keep	Outside-eyes-suggested disambig: dense-attn HSM (16 keys × d_model) WITHOUT static side memory crowding (TRIGRAM_SIDE_MEMORY=0). val 2.008 vs 0064 baseline (no HSM, no side mem) ~2.003 = +0.005 NEUTRAL. CONFIRMS original 0073/0080 interpretation: HSM doesn't help even without static-memory crowding → "200 steps too short for learnable HSM" is correct, not a crowding artifact. Closes unified-LR-hypothesis disambiguation. [transfer:high — settles load-bearing assumption]
0084_longkernel_conv1d	0076_confidence_gated_blend	1.96008436	2.0170	-0.056916	16.056	8588.69	false	true	discard	Re-launch (first attempt killed by MPS contention). Body-axis temporal probe per outside-eyes flag: kill-Mamba-2 conv1d kernel 4→16. val 1.960 vs 0076 1.948 = +0.012 REGRESSION + cap-bust 16.05 MB. Kernel=4 was already saturated for 200-step regime; longer kernel adds capacity model can't use AND adds 50KB per layer that brotli compresses poorly. Body-axis temporal axis at MPS 200 steps: closed. May still help at H100 20k. [transfer:medium-low — try at H100 if other temporal tests show signal]
0096_ternary_long_train_mps	0093_ternary_lr_rescue_packed	null	null	null	null	8674.74	true	false	TODO	TODO
0001_regression_check_cuda	canonical	2.43458582	2.4340	0.000586	11.404	314.62	false	false	crash	pre-fix sentinel; LR-schedule mismatch (canonical defaults vs script-set), ignore as anchor — superseded by 0002. [transfer:n/a]
0002_regression_check_cuda_v2	canonical	2.51151506	2.5041	0.007415	6.914	134.13	false	false	sentinel	CUDA anchor val_bpb 2.5115 vs MPS anchor 2.5212 = 0.0097 bf16-reduction-order drift. All future CUDA Δ-comparisons go against 2.5115. step_avg_ms 134 on 5090 = ~10× MPS speedup. [transfer:n/a — anchor]
0097_cloud_workflow_smoke	canonical	2.86787287	2.8682	-0.000327	7.827	199.64	false	false	keep	cloud workflow validation smoke (e2e: new_experiment.sh → push → pull → preflight → tmux launch → commit-from-pod → pull on Mac). Artificially low ITERATIONS=20 so val 2.87 ≫ anchor — not a real eval, just exercises the path. [transfer:n/a]
0098_ssm_frontier_cuda_200	0064_brotli_swap	2.00284328	1.9999	0.002943	13.449	691.58	false	false	sentinel	CUDA SSM anchor: kill-Mamba-2 triple-parallel + brotli reproduce of MPS 0064 (val 2.0030) on RTX 5090. val_bpb 2.0028 (Δ -0.0002, clean MPS→CUDA transfer). step_avg 692ms = 12.5x MPS speedup. step1 train_loss 20.6 (>>ln(vocab)=6.93) is expected for TIED_EMBED_INIT_STD=0.05 + recur+SwiGLU stack — model recovers by step 10, final val matches MPS exactly. [transfer:n/a — anchor]
0099_ternary_extended_cuda_2k	0093_ternary_lr_rescue_packed	null	1.6499	null	7.847	259.30	true	false	crash	BitNet 25x test, 2000 CUDA steps. PRE-QUANT val_bpb 1.6499 (vs 0093 MPS pre-quant 2.0563 = -0.41 BPB just from 10x training; vs 0098 SSM frontier 200-step pre-quant 2.0000 = -0.35). Post-quant CRASHED in eval — torch.compile/dynamo bug at trigram_side_memory.py:634 (Tensor.item() with capture_scalar_outputs=False). Pre-quant is the BitNet penalty test signal; post-quant requires fixing the dynamo bug or disabling torch.compile. step_avg 259ms artifact 7.85 MB (cap-clear). [transfer:medium — pre-quant only]
0100_dendritic_extended_cuda_2k	0092_dendritic_memory_v1	1.66676036	1.6659	0.00086	5.277	553.06	false	false	keep	dendritic memory v1 extended to 2000 CUDA steps. Pre-quant 1.6659, post-quant 1.6668 (vs 0099 ternary+LR3 2k pre-quant 1.6499 = +0.016, confounded: dendritic+default-LR vs no-dendritic+LR×3). Artifact 5.28 MB (huge headroom). At MPS 200 steps 0094 had dendritic+LR×3 vs 0093 no-dendritic+LR×3 = +0.007 (neutral); CUDA 2k pattern looks similar. Note: torch.compile DISABLED for this exp (fullgraph rejects boolean indexing in dendritic_memory.forward); 553ms/step vs 0099/0103 expected ~250ms with compile. [transfer:medium — n=1 but consistent w/ MPS pattern of dendritic-neutral]
0101_transformer_baseline_cuda_2k	0076_confidence_gated_blend	1.57505721	1.5739	0.00114	13.444	217.37	false	false	keep	transformer baseline (no ternary, no dendritic, default LR, TRIGRAM_SIDE_MEMORY=0) at CUDA 2000 steps batch 24576. Pre-quant 1.5739, post-quant ~1.575 (default fp16+int8 quant). vs 0099 ternary+LR×3 pre-quant 1.6499 = ternary penalty +0.076 BPB at 2k CUDA. vs MPS-200 penalty ~+0.10, narrowed by 0.024 in 10x training. BitNet 25x claim qualitatively supported but slowly enough at our 27M-param SP1024 regime that H100 20k would still leave ~+0.05 ternary penalty. Strong directional negative for ternary as the deployment recipe. [transfer:high — n=1 anchor for the 2k CUDA decomposition]
0101_transformer_baseline_cuda_2k	0076_confidence_gated_blend	1.57934060	1.5780	0.001341	22.127	206.01	false	true	TODO	TODO
0102_ssm_frontier_ternary_cuda_2k	0099_ternary_extended_cuda_2k	1.54173951	1.5414	0.00034	5.629	813.57	false	false	keep	SSM frontier (kill-Mamba-2 triple-parallel) + ternary body + LR canonical 0.045 + brotli, at production batch 131072 × 1000 steps (131M tokens trained, ~1.3% of dataset). Pre-quant 1.5414, post-quant 1.5417 (quant_tax 0.0003 — packed-ternary makes quant near-lossless). artifact 5.63 MB (huge cap headroom). vs 0101 transformer baseline 1.5739 (small batch 2k steps): -0.032 BPB. vs 0099 transformer+ternary+LR3 1.6499 (small batch 2k steps): -0.108 BPB. SSM × ternary × production-batch compound is a real win at this regime. [transfer:high — best result of session]
0103_ssm_frontier_cuda_2k	0098_ssm_frontier_cuda_200	1.45907007	1.4587	0.00037	21.426	802.99	false	true	keep	SSM frontier (kill-Mamba-2 triple-parallel) NO ternary, canonical LR=0.045, production batch 131072 × 1000 steps. Pre-quant 1.4587, post-quant 1.4591 — BEST val_bpb of session but CAP-BUSTS at 21.43 MB (no ternary → int8-stored body weights bloat artifact). vs 0102 (same config + ternary, 5.6 MB): 0102 val higher by +0.082 BPB but submittable. Cleanest cap/val tradeoff demo: ternary trades +0.082 val for -15.8 MB cap. [transfer:high — ineligible for submission, but anchors cap-vs-val curve]
0104_ssm_frontier_long_5k	0098_ssm_frontier_cuda_200	1.3441858	1.3415	0.002686	24.057	712.22	false	true	keep	SSM frontier (kill-Mamba-2 triple-parallel) NO ternary, canonical LR=0.045, production batch 131072 × 5000 steps (655M tokens, ~6.5% of fineweb10B). Pre-quant 1.3415, post-quant 1.3442 (quant_tax 0.003). artifact 24.06 MB CAP-BUSTS — same architecture as 0103 just trained 5x longer. vs 0103 (1k steps, same arch): -0.115 BPB just from 5x training. vs 0102 (submittable best with ternary): -0.20 BPB. vs SP1024 record 1.1063: gap 0.24 BPB → records likely reachable with another 5x training (~25k steps) plus standard-stack ports. Best raw val of session, ineligible for submission. [transfer:high — establishes scaling slope on SSM frontier]
0105_ssm_frontier_ternary_seed42	0102_ssm_frontier_ternary_cuda_2k	1.55065707	1.5499	0.000757	5.52	718.83	false	false	keep	SEED=42 cross-seed confirm of 0102 (SSM frontier + ternary + production batch + canonical LR + 1k steps). Post-quant 1.5507 (vs 0102 SEED=1337 1.5417, σ_pair ~0.009). 2-seed mean = 1.5462. Beats prior session winner 0076/0077 (mean 1.95141) by -0.405 BPB at different regime (CUDA production batch vs MPS small batch). Promote candidate. [transfer:high — n=2 confirm]
0106_full_selectivity_prod	0103_ssm_frontier_cuda_2k	3.54340927	3.5428	0.000609	22.818	805.41	false	true	discard	Full-selectivity Mamba-2 at production batch + LR=0.045 DIVERGED (val 3.54, train_loss froze 6.05 nats). LR too aggressive once selectivity adds dt/B/C projections at bigger gradient signal. Confirms kill > full at production batch by exclusion. [transfer:n/a]
0107_bigger_ternary_ssm_prod	0102_ssm_frontier_ternary_cuda_2k	1.52561499	1.5252	0.000415	9.08	1345.1	false	false	keep	Bigger SSM (NUM_UNIQUE_LAYERS=5, all parallel) + ternary at production batch × 1k steps. Pre 1.5252 / post 1.5256 / 9.08 MB. vs 0102 (3 layers same recipe): -0.016 at +60% params. vs 0103 (smaller no-ternary, cap-bust): +0.066. Cap-trade pays partially back. step_avg 1345ms. [transfer:medium — n=1, needs 0108 SEED=42 confirm]
0108_bigger_ternary_seed42	0107_bigger_ternary_ssm_prod	1.52075876	1.52	0.000759	9.027	1205.84	false	false	keep	SEED=42 confirm of 0107 (NUM_UNIQUE_LAYERS=5 + ternary at production batch). Post-quant 1.5208 (vs 0107 SEED=1337 1.5256). 2-seed mean 1.5232 sigma_pair 0.0034. New best submittable 2-seed result of session, beats 0102/0105 mean 1.5462 by -0.023 BPB. Artifact 9.03 MB. PROMOTE candidate. [transfer:high - n=2 with tight sigma]
0109_pure_attn_prod	0098_ssm_frontier_cuda_200	1.46994317	1.4697	0.000243	17.45	424.36	false	true	keep	Pure-attn (ATTN_LAYER_POSITIONS=0,1,2, no SSM) at production batch x 1k steps. Post-quant 1.4699 / cap-bust 17.45 MB. vs 0103 (SSM frontier same regime): +0.011 BPB. SSM contribution at production scale = -0.011 BPB, MUCH smaller than MPS-200's -0.085. SSM advantage SHRINKS at scale - meaningful negative finding for SSM thesis. step_avg 424 ms. [transfer:high - n=1 anchor, recasts SSM contribution at scale]
0111_bigger_ternary_n7	0107_bigger_ternary_ssm_prod	1.55358965	1.5529	0.00069	12.047	1887.91	false	false	TODO	TODO
0112_kill_scan_ablation	0103_ssm_frontier_cuda_2k	1.50485066	1.5042	0.000651	22.071	580.96	false	true	TODO	TODO
0113_full_sel_rescue_lr_third	0103_ssm_frontier_cuda_2k	1.48983433	1.4882	0.001634	17.649	713.54	false	true	keep	Full-selectivity at MATRIX_LR=0.015 (= canonical/3). Trained STABLY at LR/3 (vs 0106 diverged at LR=0.045). Post-quant 1.4898 / 17.65 MB cap-bust / step 714ms. Δ vs 0103 (kill, same recipe) = +0.031 BPB. KILL > FULL at production scale is ARCHITECTURAL, not LR-cliff artifact. _B_const/_C_const LTI prior beats input-dependent dt/B/C from in_proj at 1k steps. [transfer:high]
0115_parallel_resid_n5_ternary	0107_bigger_ternary_ssm_prod	1.57224157	1.5719	0.000342	9.161	1348.78	false	false	keep	PARALLEL_RESIDUAL=1 starting at virtual layer 10 (of 15) on n=5 ternary. Post-quant 1.5722 (vs 0107 1.5256 = +0.047). step_avg 1349ms similar to 0107. Records' parallel-residuals gain (-0.0022 BPB) is at H100 6k+ steps; 1k smoke shows the +x_split offset at merge boundary requires significant training to learn-around. Tier-1 port DOES NOT compose at 1k on our SSM stack — keep on H100-deploy candidate list with 'needs longer training' tag. [transfer:medium]
0116_ema_n5_ternary	0107_bigger_ternary_ssm_prod	2.20220103	2.2033	-0.001099	8.926	1205.30	false	false	keep	EMA-of-weights port (records' tier-1 technique). beta=0.999 + 1k steps -> shadow effective window = ENTIRE training, so shadow weights ~ near-init. Final post-quant 2.2022 / 8.93 MB / step 1205ms reflects this: EMA INFRASTRUCTURE works (no NaN, trains stably, shadow swap at last_step + quant export both succeed) but beta=0.999 is the wrong hyperparameter for 1k-step training (predicted in scratch/2026-04-29_ema_derivation.md). For H100 5k+ steps, beta=0.999 is correct (window=1000 = last 1/5 to 1/6 of training). Re-run with beta=0.99 (window=100, captures only late training) would land near 0107 1.5256. Tier-1 port marked verified-implementation, awaits H100 deploy. [transfer:high - infrastructure verified, hyperparameter for H100 confirmed]
0118_spike_rank_v1_n5_ternary	0107_bigger_ternary_ssm_prod	1.88485280	1.8535	0.031353	9.078	1341.53	false	false	keep	Spike-rank embedding v1 (sparse-only, brief option c): replace nn.Embedding + tied lm_head with K=8 sparse rows via top-K STE on V x d weight. Math + 5 progressive toys verified pre-build (synthetic next-token converges to 0.0 loss). Post-quant 1.8849 / 9.08 MB (NO cap savings vs 0107 — sparse weight stored densely at int8) / step 1342ms / quant_tax 0.031 (high — sparse-weight value dynamic range hurts int8). Δ +0.359 vs 0107 — most-regressed of session. Likely K=8 too restrictive for 1024-vocab embeddings (loses per-token expressiveness); v1.5 with K=32 or sparse storage format (indices + values) would test cap savings claim. Both novel mechanisms (0117 + 0118) materially worse at 1k smoke — consistent with brief's note that single-seed at 200 MPS / 1k CUDA is too short for learnable structures. Real test = H100 5k+ steps with v2 designs (DFSM ordering for 0117, K=32 + sparse storage for 0118). [transfer:medium - infrastructure verified; v1 mechanism not competitive at 1k smoke]
